{
  "_id": null,
  "analysis": {
    "collector_comments": null,
    "context": {
      "collection_context": "Collected at a dorm in Berkeley, Ca.",
      "cultural_background": "Defne first heard this proverb from her best friend Banu's mother in Ayvalik, Turkey, when the two girls were on a summer vacation in this resort town, at the age of fifteen in 1994. Banu, who was sixteen at the time, was living a terribly frivolous and extreme life style that included a great deal of parties and frivolous spending. Also, given that they were in a resort town, she had little time to concern herself with such mundane activities as chores and homework that had always kept he so grounded in the past. According to the informant, This proverb has only one meaning: living an extreme life far removed from any balance can do serious damage to an individual.",
      "use_context": "This proverb, which is used by both male and female adults, is most often directed towards young people in their late teens and early twenties."
    },
    "interpretation": "In this proverb, I [text partly illegible] vinegar as being of an extremely acidic substance that does damage to every thing it touches. The vinegar, thus, represents a destructive force that can \"eat away\" at an individual. The container can be interpreted as representing the body, which can be damaged and harmed by such extreme activities as drinking, abusing drugs, and smoking."
  },
  "cleaned_full_text": "Defne Ezgi, female, 18\nTurkish-American Student (U.C.Berkeley)\nEnglish, Turkish, Erench\nBerkeley, Ca. (collected at dorm)\nNovember 19, 1997\n\n4 [rect] Keskin\nsirke kupune zarar\npungent vinegar to its container harm\n\nPungent vinegar is harmful to its container.\n\nDefne first heard this proverb from her best friend Banu's mother in Ayvalik, ‘Turkey, when the two girls were on a summer vacation in this resort town, at the age of fifteen in 1994, Banu, who was sixteen at the time, was living a terribly frivolous and extreme life style that included a great deal of parties and frivolous spending. Also, given that they were in a resort town, she had little time to concern herself with such mundane activities as chores and homework that had always kept he so grounded in the past. According to the informant, This proverb has only one meaning: living an extreme life far removed from any balance can do serious damage to an individual.\n\nThe following interpretation represents the thoughts of the collector, although I presented this interpretation to the informant and it met with her approval. This proverb, which is used by both male and female adults, is most often directed towards young people in their late teens and early twenties. In this proverb, I i vinegar as being of an extremely acidic substance that does damage to every thing it touches. The vinegar, thus, represents a destructive force that can “eat away” at an individual. The container can be interpreted as representing the body, which can be damaged and harmed by such extreme activities as drinking, abusing drugs, and smoking.\n\nVivian Samano, 19\n2601 Warring, #215\nBerkeley, Ca. 94720",
  "collector": {
    "collector_comments": "The following interpretation represents the thoughts of the collector, although I presented this interpretation to the informant and it met with her approval.",
    "gender": null,
    "name": "Vivian Samano"
  },
  "contributor": {
    "age_bucket": "18-24",
    "ethnicity": null,
    "gender": "female",
    "languages_spoken": [
      "English",
      "Turkish",
      "French"
    ],
    "name": "Defne Ezgi",
    "nationality": "Turkish-American",
    "occupation": "Student (U.C.Berkeley)"
  },
  "date_collected": "November 19, 1997",
  "filename": "JSONs/Turkey Proverbs.pdf",
  "folklore": {
    "item": "Keskin sirke kupune zarar",
    "medium": null,
    "place_mentioned": [
      {
        "city": "Ayvalik",
        "country": "Turkey",
        "geolocation": null,
        "state": null
      }
    ],
    "translation": "pungent vinegar to its container harm; Pungent vinegar is harmful to its container."
  },
  "location_collected": {
    "city": "Berkeley",
    "country": null,
    "geolocation": null,
    "state": "Ca."
  },
  "storage_medium": "PDF"
}
